{
  "$defs": {
    "iso_dt": {
      "pattern": "^\\d{4}-\\d{2}-\\d{2}T\\d{2}:\\d{2}:\\d{2}Z$",
      "type": "string"
    },
    "path": {
      "minLength": 1,
      "type": "string"
    },
    "run_id": {
      "pattern": "^[a-z0-9][a-z0-9\\-]{6,64}$",
      "type": "string"
    },
    "sha256": {
      "pattern": "^[a-f0-9]{64}$",
      "type": "string"
    }
  },
  "$schema": "https://json-schema.org/draft/2020-12/schema",
  "additionalProperties": false,
  "properties": {
    "annexes": {
      "additionalProperties": true,
      "type": "object"
    },
    "claim": {
      "type": "string"
    },
    "created_at": {
      "$ref": "#/$defs/iso_dt"
    },
    "entity": {
      "additionalProperties": true,
      "type": "object"
    },
    "evidence": {
      "items": {
        "additionalProperties": true,
        "type": "object"
      },
      "type": "array"
    },
    "hashes": {
      "additionalProperties": false,
      "properties": {
        "packet": {
          "$ref": "#/$defs/sha256"
        }
      },
      "required": [
        "packet"
      ],
      "type": "object"
    },
    "lineage": {
      "items": {
        "type": "string"
      },
      "type": "array"
    },
    "packet_id": {
      "type": "string"
    },
    "review": {
      "additionalProperties": false,
      "properties": {
        "reason": {
          "type": "string"
        },
        "status": {
          "enum": [
            "CLEAR",
            "REVIEW"
          ],
          "type": "string"
        }
      },
      "required": [
        "status",
        "reason"
      ],
      "type": "object"
    },
    "run_id": {
      "$ref": "#/$defs/run_id"
    },
    "schema_version": {
      "enum": [
        "1.0"
      ],
      "type": "string"
    }
  },
  "required": [
    "schema_version",
    "run_id",
    "packet_id",
    "created_at",
    "claim",
    "entity",
    "evidence",
    "lineage",
    "review",
    "hashes"
  ],
  "title": "Evidence packet",
  "type": "object"
}
