{
  "annexes": {
    "intangibles": [],
    "maritime_legs": [],
    "payments": [
      {
        "amount_usd": 139360.52,
        "currency": "USD",
        "insurer": "",
        "intermediary_bank": "RIVERMARK FINANCE",
        "method": "CARD",
        "payee_name": "SABLE HOLDINGS",
        "payer_name": "QUARRY PARTNERS IMPORTS",
        "payment_date": "2024-12-25",
        "payment_id": "P000088",
        "shipment_id": "S000088"
      },
      {
        "amount_usd": 14569.41,
        "currency": "USD",
        "insurer": "",
        "intermediary_bank": "HARBORLIGHT TRUST",
        "method": "WIRE",
        "payee_name": "SABLE HOLDINGS",
        "payer_name": "JUNIPER VENTURES TRADING",
        "payment_date": "2024-04-23",
        "payment_id": "P000118",
        "shipment_id": "S000118"
      },
      {
        "amount_usd": 154871.48,
        "currency": "USD",
        "insurer": "",
        "intermediary_bank": "STONEBRIDGE BANK",
        "method": "CARD",
        "payee_name": "SABLE HOLDINGS",
        "payer_name": "BASALT VENTURES DISTRIBUTION",
        "payment_date": "2024-02-20",
        "payment_id": "P000176",
        "shipment_id": "S000176"
      },
      {
        "amount_usd": 128659.71,
        "currency": "USD",
        "insurer": "ANCHOR MUTUAL",
        "intermediary_bank": "HARBORLIGHT TRUST",
        "method": "WIRE",
        "payee_name": "SABLE TRADING",
        "payer_name": "MARINER PARTNERS DISTRIBUTION",
        "payment_date": "2024-09-29",
        "payment_id": "P000200",
        "shipment_id": "S000200"
      }
    ],
    "procurement": [
      {
        "award_date": "2024-11-27",
        "buyer_name": "MARINER VENTURES TRADING",
        "description": "LUXURY_DUAL_USE_CONSUMER PROCUREMENT (INVENTED)",
        "domain": "luxury_dual_use_consumer",
        "notice_date": "2024-02-02",
        "supplier_name": "SABLE HOLDINGS",
        "tender_id": "T00018",
        "value_usd": 201128.85
      }
    ],
    "research_links": [],
    "services": [
      {
        "counterparty_name": "SABLE PARTNERS SUPPLY",
        "description": "CONTRACT_MFG SERVICE (INVENTED)",
        "end_date": "2024-03-20",
        "provider_name": "SABLE HOLDINGS",
        "service_id": "SV00008",
        "service_type": "CONTRACT_MFG",
        "start_date": "2024-09-18",
        "value_usd": 75101.5
      },
      {
        "counterparty_name": "NEBULA GLOBAL HOLDING",
        "description": "CALIBRATION SERVICE (INVENTED)",
        "end_date": "2024-12-12",
        "provider_name": "SABLE HOLDINGS",
        "service_id": "SV00040",
        "service_type": "CALIBRATION",
        "start_date": "2024-09-06",
        "value_usd": 51635.56
      }
    ]
  },
  "claim": "Entity exhibits elevated chokepoint exposure under the reference scoring model.",
  "created_at": "2010-12-17T09:01:39Z",
  "entity": {
    "chokepoint_score": 0.0,
    "country": "KR",
    "entity_id": "E0016",
    "entity_name": "SABLE HOLDINGS",
    "shipment_count": 4,
    "total_value_usd": 458604.36
  },
  "evidence": [
    {
      "domain": "services",
      "hs_code": "999710",
      "incoterm": "CFR",
      "match_score": 1.0,
      "match_status": "MATCH",
      "ship_date": "2024-12-25",
      "shipment_id": "S000088",
      "transport_mode": "RAIL",
      "value_usd": 117644.4
    },
    {
      "domain": "luxury_dual_use_consumer",
      "hs_code": "870324",
      "incoterm": "CIF",
      "match_score": 1.0,
      "match_status": "MATCH",
      "ship_date": "2024-04-23",
      "shipment_id": "S000118",
      "transport_mode": "AIR",
      "value_usd": 18504.1
    },
    {
      "domain": "procurement",
      "hs_code": "996000",
      "incoterm": "FCA",
      "match_score": 1.0,
      "match_status": "MATCH",
      "ship_date": "2024-02-20",
      "shipment_id": "S000176",
      "transport_mode": "ROAD",
      "value_usd": 198661.62
    },
    {
      "domain": "medical_bio_lab",
      "hs_code": "382219",
      "incoterm": "EXW",
      "match_score": 0.5,
      "match_status": "REVIEW",
      "ship_date": "2024-09-29",
      "shipment_id": "S000200",
      "transport_mode": "RAIL",
      "value_usd": 123794.24
    }
  ],
  "hashes": {
    "packet": "c74881d5d590c98b605a82d22e574bb96993e211457433ab09a9ef23f4e480ad"
  },
  "lineage": [
    "RESOLVE",
    "ANALYZE",
    "EXPORT"
  ],
  "packet_id": "packet-E0016",
  "review": {
    "reason": "at_least_one_low_confidence_match",
    "status": "REVIEW"
  },
  "run_id": "run-781327b7-a7a5",
  "schema_version": "1.0"
}
