{
  "annexes": {
    "intangibles": [
      {
        "description": "PROCESS_RECIPE TRANSFER (INVENTED)",
        "intangible_id": "I00008",
        "intangible_type": "PROCESS_RECIPE",
        "owner_name": "MARINER MANUFACTURING SYSTEMS",
        "transfer_date": "2024-02-19",
        "transfer_mode": "PORTAL"
      }
    ],
    "maritime_legs": [
      {
        "arrive_date": "2024-11-29",
        "carrier": "NORTHWIND LINES",
        "depart_date": "2024-11-29",
        "from_port": "PORT HALCYON",
        "leg_id": "L000116",
        "shipment_id": "S000116",
        "to_port": "PORT KESTREL",
        "transshipment": 0,
        "vessel_type": "TANKER"
      },
      {
        "arrive_date": "2024-10-24",
        "carrier": "BLUE QUAY SHIPPING",
        "depart_date": "2024-10-24",
        "from_port": "PORT IRONLEAF",
        "leg_id": "L000163",
        "shipment_id": "S000163",
        "to_port": "PORT ASTER",
        "transshipment": 0,
        "vessel_type": "CONTAINER"
      },
      {
        "arrive_date": "2024-05-24",
        "carrier": "HELIOS MARITIME",
        "depart_date": "2024-05-24",
        "from_port": "PORT KESTREL",
        "leg_id": "L000179",
        "shipment_id": "S000179",
        "to_port": "PORT HALCYON",
        "transshipment": 1,
        "vessel_type": "TANKER"
      }
    ],
    "payments": [
      {
        "amount_usd": 74549.96,
        "currency": "USD",
        "insurer": "",
        "intermediary_bank": "STONEBRIDGE BANK",
        "method": "LC",
        "payee_name": "MARINER MANUFACTURING SYSTEMS",
        "payer_name": "TIDEMARK CO SUPPLY",
        "payment_date": "2024-04-03",
        "payment_id": "P000080",
        "shipment_id": "S000080"
      },
      {
        "amount_usd": 80668.7,
        "currency": "USD",
        "insurer": "",
        "intermediary_bank": "RIVERMARK FINANCE",
        "method": "LC",
        "payee_name": "MARINER-MANUFACTURING-SYSTEMS",
        "payer_name": "KESTREL HOUSE DISTRIBUTION",
        "payment_date": "2024-06-22",
        "payment_id": "P000099",
        "shipment_id": "S000099"
      },
      {
        "amount_usd": 142454.09,
        "currency": "USD",
        "insurer": "EMBER UNDERWRITERS",
        "intermediary_bank": "RIVERMARK FINANCE",
        "method": "LC",
        "payee_name": "MARINER-MANUFACTURING-SYSTEMS",
        "payer_name": "TIDEMARK CO SUPPLY",
        "payment_date": "2024-11-29",
        "payment_id": "P000116",
        "shipment_id": "S000116"
      },
      {
        "amount_usd": 261891.88,
        "currency": "USD",
        "insurer": "",
        "intermediary_bank": "HARBORLIGHT TRUST",
        "method": "WIRE",
        "payee_name": "MARINER MANUFACTURING SYSTEMS",
        "payer_name": "BASALT HOUSE IMPORTS",
        "payment_date": "2024-10-24",
        "payment_id": "P000163",
        "shipment_id": "S000163"
      },
      {
        "amount_usd": 218571.87,
        "currency": "USD",
        "insurer": "",
        "intermediary_bank": "STONEBRIDGE BANK",
        "method": "WIRE",
        "payee_name": "MARINER MANUFACTURING SYSTEMS",
        "payer_name": "PENDULUM GLOBAL DISTRIBUTION",
        "payment_date": "2024-05-24",
        "payment_id": "P000179",
        "shipment_id": "S000179"
      }
    ],
    "procurement": [],
    "research_links": [
      {
        "entity_name": "MARINER MANUFACTURING SYSTEMS",
        "lab_name": "AURELINE LAB",
        "link_date": "2024-01-21",
        "link_id": "R00004",
        "publication_title": "INVENTED STUDY 4: THERMALS",
        "similarity": 0.526
      }
    ],
    "services": [
      {
        "counterparty_name": "IRONLEAF GLOBAL IMPORTS",
        "description": "MAINTENANCE SERVICE (INVENTED)",
        "end_date": "2024-09-19",
        "provider_name": "MARINER MANUFACTURING SYSTEMS",
        "service_id": "SV00030",
        "service_type": "MAINTENANCE",
        "start_date": "2024-04-20",
        "value_usd": 66714.81
      }
    ]
  },
  "claim": "Entity exhibits elevated chokepoint exposure under the reference scoring model.",
  "created_at": "2007-05-05T21:05:03Z",
  "entity": {
    "chokepoint_score": 0.0,
    "country": "BR",
    "entity_id": "E0015",
    "entity_name": "MARINER MANUFACTURING SYSTEMS",
    "shipment_count": 6,
    "total_value_usd": 988881.52
  },
  "evidence": [
    {
      "domain": "services",
      "hs_code": "999720",
      "incoterm": "EXW",
      "match_score": 1.0,
      "match_status": "MATCH",
      "ship_date": "2024-04-03",
      "shipment_id": "S000080",
      "transport_mode": "AIR",
      "value_usd": 85601.9
    },
    {
      "domain": "machine_tools",
      "hs_code": "845811",
      "incoterm": "DAP",
      "match_score": 1.0,
      "match_status": "MATCH",
      "ship_date": "2024-06-22",
      "shipment_id": "S000099",
      "transport_mode": "AIR",
      "value_usd": 75136.23
    },
    {
      "domain": "procurement",
      "hs_code": "996010",
      "incoterm": "FCA",
      "match_score": 1.0,
      "match_status": "MATCH",
      "ship_date": "2024-11-29",
      "shipment_id": "S000116",
      "transport_mode": "SEA",
      "value_usd": 176160.06
    },
    {
      "domain": "maritime_shipbuilding_ports",
      "hs_code": "842620",
      "incoterm": "DAP",
      "match_score": 1.0,
      "match_status": "MATCH",
      "ship_date": "2024-10-24",
      "shipment_id": "S000163",
      "transport_mode": "SEA",
      "value_usd": 215248.04
    },
    {
      "domain": "procurement",
      "hs_code": "996030",
      "incoterm": "CFR",
      "match_score": 1.0,
      "match_status": "MATCH",
      "ship_date": "2024-05-24",
      "shipment_id": "S000179",
      "transport_mode": "SEA",
      "value_usd": 216325.37
    }
  ],
  "hashes": {
    "packet": "cb36223fc154711d055d5868f64af5f2043458162a2d375b0d528a37faa2912f"
  },
  "lineage": [
    "RESOLVE",
    "ANALYZE",
    "EXPORT"
  ],
  "packet_id": "packet-E0015",
  "review": {
    "reason": "sufficient_confidence",
    "status": "CLEAR"
  },
  "run_id": "run-781327b7-a7a5",
  "schema_version": "1.0"
}
