{
  "annexes": {
    "intangibles": [
      {
        "description": "DESIGN TRANSFER (INVENTED)",
        "intangible_id": "I00003",
        "intangible_type": "DESIGN",
        "owner_name": "MARINER MANUFACTURING LABORATORIES S.A.",
        "transfer_date": "2024-12-19",
        "transfer_mode": "PORTAL"
      },
      {
        "description": "TEST_SUITE TRANSFER (INVENTED)",
        "intangible_id": "I00017",
        "intangible_type": "TEST_SUITE",
        "owner_name": "MARINER MANUFACTURING LABORATORIES S.A.",
        "transfer_date": "2024-07-27",
        "transfer_mode": "PORTAL"
      }
    ],
    "maritime_legs": [],
    "payments": [
      {
        "amount_usd": 167511.4,
        "currency": "USD",
        "insurer": "",
        "intermediary_bank": "HARBORLIGHT TRUST",
        "method": "LC",
        "payee_name": "MARINER MANUFACTURING LABORATORIES S.A.",
        "payer_name": "QUARRY GLOBAL TRADING",
        "payment_date": "2024-07-26",
        "payment_id": "P000082",
        "shipment_id": "S000082"
      },
      {
        "amount_usd": 123818.63,
        "currency": "USD",
        "insurer": "",
        "intermediary_bank": "HARBORLIGHT TRUST",
        "method": "NETTING",
        "payee_name": "MARINER MANUFACTURING LABORATORIES S.A.",
        "payer_name": "AURELINE HOUSE SUPPLY",
        "payment_date": "2024-01-05",
        "payment_id": "P000101",
        "shipment_id": "S000101"
      },
      {
        "amount_usd": 10207.61,
        "currency": "USD",
        "insurer": "",
        "intermediary_bank": "STONEBRIDGE BANK",
        "method": "CARD",
        "payee_name": "MARINER MANUFACTURING LABORATORIES S.A.",
        "payer_name": "KESTREL PARTNERS SUPPLY",
        "payment_date": "2024-09-03",
        "payment_id": "P000107",
        "shipment_id": "S000107"
      },
      {
        "amount_usd": 45328.49,
        "currency": "USD",
        "insurer": "",
        "intermediary_bank": "HARBORLIGHT TRUST",
        "method": "WIRE",
        "payee_name": "MARINER-MANUFACTURING-LABORATORIES-S.A.",
        "payer_name": "QUARRY PARTNERS IMPORTS",
        "payment_date": "2024-07-27",
        "payment_id": "P000141",
        "shipment_id": "S000141"
      },
      {
        "amount_usd": 33464.42,
        "currency": "USD",
        "insurer": "",
        "intermediary_bank": "STONEBRIDGE BANK",
        "method": "LC",
        "payee_name": "MARINER MANUFACTURING LABORATORIES S.A..",
        "payer_name": "AURELINE VENTURES DISTRIBUTION",
        "payment_date": "2024-01-28",
        "payment_id": "P000193",
        "shipment_id": "S000193"
      }
    ],
    "procurement": [],
    "research_links": [],
    "services": []
  },
  "claim": "Entity exhibits elevated chokepoint exposure under the reference scoring model.",
  "created_at": "2009-02-17T03:41:02Z",
  "entity": {
    "chokepoint_score": 0.0,
    "country": "US",
    "entity_id": "E0013",
    "entity_name": "MARINER MANUFACTURING LABORATORIES S.A.",
    "shipment_count": 7,
    "total_value_usd": 501168.85
  },
  "evidence": [
    {
      "domain": "energy_equipment",
      "hs_code": "850164",
      "incoterm": "FOB",
      "match_score": 1.0,
      "match_status": "MATCH",
      "ship_date": "2024-07-26",
      "shipment_id": "S000082",
      "transport_mode": "RAIL",
      "value_usd": 203173.17
    },
    {
      "domain": "intangibles",
      "hs_code": "998100",
      "incoterm": "FCA",
      "match_score": 1.0,
      "match_status": "MATCH",
      "ship_date": "2024-01-05",
      "shipment_id": "S000101",
      "transport_mode": "AIR",
      "value_usd": 95368.04
    },
    {
      "domain": "research_links",
      "hs_code": "995020",
      "incoterm": "EXW",
      "match_score": 1.0,
      "match_status": "MATCH",
      "ship_date": "2024-09-03",
      "shipment_id": "S000107",
      "transport_mode": "RAIL",
      "value_usd": 11907.38
    },
    {
      "domain": "intangibles",
      "hs_code": "998120",
      "incoterm": "DAP",
      "match_score": 1.0,
      "match_status": "MATCH",
      "ship_date": "2024-07-27",
      "shipment_id": "S000141",
      "transport_mode": "RAIL",
      "value_usd": 57671.38
    },
    {
      "domain": "finance_signals",
      "hs_code": "997030",
      "incoterm": "CFR",
      "match_score": 1.0,
      "match_status": "MATCH",
      "ship_date": "2024-01-28",
      "shipment_id": "S000193",
      "transport_mode": "AIR",
      "value_usd": 42011.8
    }
  ],
  "hashes": {
    "packet": "c734c453ea302d4ec69d4771573633d802a989f44994012f1de0014ec18b9db6"
  },
  "lineage": [
    "RESOLVE",
    "ANALYZE",
    "EXPORT"
  ],
  "packet_id": "packet-E0013",
  "review": {
    "reason": "sufficient_confidence",
    "status": "CLEAR"
  },
  "run_id": "run-781327b7-a7a5",
  "schema_version": "1.0"
}
