{
  "annexes": {
    "intangibles": [],
    "maritime_legs": [],
    "payments": [
      {
        "amount_usd": 33845.07,
        "currency": "USD",
        "insurer": "ANCHOR MUTUAL",
        "intermediary_bank": "HARBORLIGHT TRUST",
        "method": "NETTING",
        "payee_name": "KESTREL BIOSCIENCE LABORATORIES PTE",
        "payer_name": "TIDEMARK CO HOLDING",
        "payment_date": "2024-03-29",
        "payment_id": "P000085",
        "shipment_id": "S000085"
      },
      {
        "amount_usd": 30186.7,
        "currency": "USD",
        "insurer": "",
        "intermediary_bank": "STONEBRIDGE BANK",
        "method": "LC",
        "payee_name": "KESTREL BIOSCIENCE LABORATORIES PTE",
        "payer_name": "RIDGELINE PARTNERS IMPORTS",
        "payment_date": "2024-05-11",
        "payment_id": "P000139",
        "shipment_id": "S000139"
      },
      {
        "amount_usd": 169390.37,
        "currency": "USD",
        "insurer": "",
        "intermediary_bank": "STONEBRIDGE BANK",
        "method": "CARD",
        "payee_name": "KESTREL-BIOSCIENCE-LABORATORIES-PTE",
        "payer_name": "AURELINE HOUSE HOLDING",
        "payment_date": "2024-02-09",
        "payment_id": "P000199",
        "shipment_id": "S000199"
      }
    ],
    "procurement": [
      {
        "award_date": "2024-02-17",
        "buyer_name": "SABLE VENTURES DISTRIBUTION",
        "description": "LUXURY_DUAL_USE_CONSUMER PROCUREMENT (INVENTED)",
        "domain": "luxury_dual_use_consumer",
        "notice_date": "2024-01-22",
        "supplier_name": "KESTREL BIOSCIENCE LABORATORIES PTE",
        "tender_id": "T00004",
        "value_usd": 106521.61
      }
    ],
    "research_links": [],
    "services": [
      {
        "counterparty_name": "MARINER VENTURES IMPORTS",
        "description": "MAINTENANCE SERVICE (INVENTED)",
        "end_date": "2024-01-20",
        "provider_name": "KESTREL BIOSCIENCE LABORATORIES PTE",
        "service_id": "SV00014",
        "service_type": "MAINTENANCE",
        "start_date": "2024-12-13",
        "value_usd": 17702.65
      },
      {
        "counterparty_name": "AURELINE GLOBAL TRADING",
        "description": "CONTRACT_MFG SERVICE (INVENTED)",
        "end_date": "2024-04-13",
        "provider_name": "KESTREL BIOSCIENCE LABORATORIES PTE",
        "service_id": "SV00019",
        "service_type": "CONTRACT_MFG",
        "start_date": "2024-08-16",
        "value_usd": 43607.05
      }
    ]
  },
  "claim": "Entity exhibits elevated chokepoint exposure under the reference scoring model.",
  "created_at": "2005-10-11T22:55:12Z",
  "entity": {
    "chokepoint_score": 0.0,
    "country": "TR",
    "entity_id": "E0017",
    "entity_name": "KESTREL BIOSCIENCE LABORATORIES PTE",
    "shipment_count": 3,
    "total_value_usd": 294238.49
  },
  "evidence": [
    {
      "domain": "finance_signals",
      "hs_code": "997010",
      "incoterm": "CFR",
      "match_score": 1.0,
      "match_status": "MATCH",
      "ship_date": "2024-03-29",
      "shipment_id": "S000085",
      "transport_mode": "AIR",
      "value_usd": 41831.69
    },
    {
      "domain": "research_links",
      "hs_code": "995000",
      "incoterm": "FCA",
      "match_score": 1.0,
      "match_status": "MATCH",
      "ship_date": "2024-05-11",
      "shipment_id": "S000139",
      "transport_mode": "ROAD",
      "value_usd": 37833.0
    },
    {
      "domain": "machine_tools",
      "hs_code": "846693",
      "incoterm": "FCA",
      "match_score": 1.0,
      "match_status": "MATCH",
      "ship_date": "2024-02-09",
      "shipment_id": "S000199",
      "transport_mode": "ROAD",
      "value_usd": 214573.8
    }
  ],
  "hashes": {
    "packet": "552fd5c4b9f1a8da151257391ae7d8a30f3f8ec06b07c39e1b92f414f3e6065f"
  },
  "lineage": [
    "RESOLVE",
    "ANALYZE",
    "EXPORT"
  ],
  "packet_id": "packet-E0017",
  "review": {
    "reason": "sufficient_confidence",
    "status": "CLEAR"
  },
  "run_id": "run-781327b7-a7a5",
  "schema_version": "1.0"
}
