{
  "annexes": {
    "intangibles": [],
    "maritime_legs": [
      {
        "arrive_date": "2024-12-19",
        "carrier": "BLUE QUAY SHIPPING",
        "depart_date": "2024-12-19",
        "from_port": "PORT ORCHID",
        "leg_id": "L000123",
        "shipment_id": "S000123",
        "to_port": "PORT KESTREL",
        "transshipment": 0,
        "vessel_type": "BULK"
      }
    ],
    "payments": [
      {
        "amount_usd": 151886.73,
        "currency": "USD",
        "insurer": "",
        "intermediary_bank": "RIVERMARK FINANCE",
        "method": "LC",
        "payee_name": "MARINER MANUFACTURING WORKS LLC",
        "payer_name": "SABLE VENTURES DISTRIBUTION",
        "payment_date": "2024-04-21",
        "payment_id": "P000035",
        "shipment_id": "S000035"
      },
      {
        "amount_usd": 230605.6,
        "currency": "USD",
        "insurer": "EMBER UNDERWRITERS",
        "intermediary_bank": "HARBORLIGHT TRUST",
        "method": "CARD",
        "payee_name": "MARINER MANUFACTURING WORKS LLC",
        "payer_name": "GOSSAMER PARTNERS SUPPLY",
        "payment_date": "2024-06-17",
        "payment_id": "P000050",
        "shipment_id": "S000050"
      },
      {
        "amount_usd": 178021.39,
        "currency": "USD",
        "insurer": "",
        "intermediary_bank": "STONEBRIDGE BANK",
        "method": "WIRE",
        "payee_name": "MARINER-MANUFACTURING-WORKS-LLC",
        "payer_name": "ORCHID VENTURES HOLDING",
        "payment_date": "2024-12-19",
        "payment_id": "P000123",
        "shipment_id": "S000123"
      }
    ],
    "procurement": [],
    "research_links": [
      {
        "entity_name": "MARINER MANUFACTURING WORKS LLC",
        "lab_name": "ORCHID LAB",
        "link_date": "2024-12-19",
        "link_id": "R00009",
        "publication_title": "INVENTED STUDY 9: MATERIALS",
        "similarity": 0.422
      }
    ],
    "services": [
      {
        "counterparty_name": "FATHOM CO HOLDING",
        "description": "CALIBRATION SERVICE (INVENTED)",
        "end_date": "2024-03-29",
        "provider_name": "MARINER MANUFACTURING WORKS LLC",
        "service_id": "SV00029",
        "service_type": "CALIBRATION",
        "start_date": "2024-01-31",
        "value_usd": 59530.59
      }
    ]
  },
  "claim": "Entity exhibits elevated chokepoint exposure under the reference scoring model.",
  "created_at": "2000-02-02T03:46:43Z",
  "entity": {
    "chokepoint_score": 0.0,
    "country": "BR",
    "entity_id": "E0007",
    "entity_name": "MARINER MANUFACTURING WORKS LLC",
    "shipment_count": 3,
    "total_value_usd": 451282.35
  },
  "evidence": [
    {
      "domain": "medical_bio_lab",
      "hs_code": "902780",
      "incoterm": "DAP",
      "match_score": 1.0,
      "match_status": "MATCH",
      "ship_date": "2024-04-21",
      "shipment_id": "S000035",
      "transport_mode": "AIR",
      "value_usd": 121360.55
    },
    {
      "domain": "energy_equipment",
      "hs_code": "850164",
      "incoterm": "DAP",
      "match_score": 1.0,
      "match_status": "MATCH",
      "ship_date": "2024-06-17",
      "shipment_id": "S000050",
      "transport_mode": "ROAD",
      "value_usd": 181605.76
    },
    {
      "domain": "energy_equipment",
      "hs_code": "850164",
      "incoterm": "CIF",
      "match_score": 1.0,
      "match_status": "MATCH",
      "ship_date": "2024-12-19",
      "shipment_id": "S000123",
      "transport_mode": "SEA",
      "value_usd": 148316.04
    }
  ],
  "hashes": {
    "packet": "4e2340d617b79280102279cd52188eb34f5228bb612b46087c714088ca31461d"
  },
  "lineage": [
    "RESOLVE",
    "ANALYZE",
    "EXPORT"
  ],
  "packet_id": "packet-E0007",
  "review": {
    "reason": "sufficient_confidence",
    "status": "CLEAR"
  },
  "run_id": "run-781327b7-a7a5",
  "schema_version": "1.0"
}
