{
  "annexes": {
    "intangibles": [],
    "maritime_legs": [],
    "payments": [
      {
        "amount_usd": 242663.86,
        "currency": "USD",
        "insurer": "EMBER UNDERWRITERS",
        "intermediary_bank": "STONEBRIDGE BANK",
        "method": "LC",
        "payee_name": "PENDULUM MARITIME ENERGY",
        "payer_name": "BASALT VENTURES TRADING",
        "payment_date": "2024-10-15",
        "payment_id": "P000062",
        "shipment_id": "S000062"
      },
      {
        "amount_usd": 154382.13,
        "currency": "USD",
        "insurer": "",
        "intermediary_bank": "SABLE CLEARING",
        "method": "CARD",
        "payee_name": "PENDULUM MARITIME ENERGY",
        "payer_name": "CANTICLE GLOBAL SUPPLY",
        "payment_date": "2024-03-09",
        "payment_id": "P000093",
        "shipment_id": "S000093"
      },
      {
        "amount_usd": 4971.38,
        "currency": "USD",
        "insurer": "",
        "intermediary_bank": "SABLE CLEARING",
        "method": "LC",
        "payee_name": "PENDULUM MARITIME ENERGY",
        "payer_name": "PENDULUM HOUSE TRADING",
        "payment_date": "2024-02-16",
        "payment_id": "P000188",
        "shipment_id": "S000188"
      }
    ],
    "procurement": [
      {
        "award_date": "2024-06-28",
        "buyer_name": "IRONLEAF CO TRADING",
        "description": "LUXURY_DUAL_USE_CONSUMER PROCUREMENT (INVENTED)",
        "domain": "luxury_dual_use_consumer",
        "notice_date": "2024-06-09",
        "supplier_name": "PENDULUM MARITIME ENERGY",
        "tender_id": "T00003",
        "value_usd": 177337.46
      }
    ],
    "research_links": [],
    "services": []
  },
  "claim": "Entity exhibits elevated chokepoint exposure under the reference scoring model.",
  "created_at": "2014-12-06T10:15:37Z",
  "entity": {
    "chokepoint_score": 0.0,
    "country": "VN",
    "entity_id": "E0010",
    "entity_name": "PENDULUM MARITIME ENERGY",
    "shipment_count": 3,
    "total_value_usd": 387362.57
  },
  "evidence": [
    {
      "domain": "aerospace_uas_avionics",
      "hs_code": "901420",
      "incoterm": "DAP",
      "match_score": 1.0,
      "match_status": "MATCH",
      "ship_date": "2024-10-15",
      "shipment_id": "S000062",
      "transport_mode": "RAIL",
      "value_usd": 253273.36
    },
    {
      "domain": "energy_equipment",
      "hs_code": "850164",
      "incoterm": "EXW",
      "match_score": 1.0,
      "match_status": "MATCH",
      "ship_date": "2024-03-09",
      "shipment_id": "S000093",
      "transport_mode": "RAIL",
      "value_usd": 127044.21
    },
    {
      "domain": "research_links",
      "hs_code": "995010",
      "incoterm": "CFR",
      "match_score": 1.0,
      "match_status": "MATCH",
      "ship_date": "2024-02-16",
      "shipment_id": "S000188",
      "transport_mode": "ROAD",
      "value_usd": 7045.0
    }
  ],
  "hashes": {
    "packet": "58fd99f42794adf30c55230703c4c1a20c7d33530ae59728eefdd433ea6ddfb3"
  },
  "lineage": [
    "RESOLVE",
    "ANALYZE",
    "EXPORT"
  ],
  "packet_id": "packet-E0010",
  "review": {
    "reason": "sufficient_confidence",
    "status": "CLEAR"
  },
  "run_id": "run-781327b7-a7a5",
  "schema_version": "1.0"
}
