{
  "annexes": {
    "intangibles": [
      {
        "description": "DESIGN TRANSFER (INVENTED)",
        "intangible_id": "I00019",
        "intangible_type": "DESIGN",
        "owner_name": "MARINER SYSTEMS INDUSTRIES S.A.",
        "transfer_date": "2024-01-06",
        "transfer_mode": "REMOTE_ACCESS"
      }
    ],
    "maritime_legs": [],
    "payments": [
      {
        "amount_usd": 69292.76,
        "currency": "USD",
        "insurer": "",
        "intermediary_bank": "STONEBRIDGE BANK",
        "method": "NETTING",
        "payee_name": "MARINER SYSTEMS INDUSTRIES S.A.",
        "payer_name": "QUARRY VENTURES SUPPLY",
        "payment_date": "2024-07-20",
        "payment_id": "P000011",
        "shipment_id": "S000011"
      },
      {
        "amount_usd": 72651.97,
        "currency": "USD",
        "insurer": "",
        "intermediary_bank": "RIVERMARK FINANCE",
        "method": "CARD",
        "payee_name": "MARINER SYSTEMS INDUSTRIES S.A.",
        "payer_name": "DORIAN VENTURES PROJECTS",
        "payment_date": "2024-11-07",
        "payment_id": "P000021",
        "shipment_id": "S000021"
      },
      {
        "amount_usd": 130095.55,
        "currency": "USD",
        "insurer": "EMBER UNDERWRITERS",
        "intermediary_bank": "STONEBRIDGE BANK",
        "method": "LC",
        "payee_name": "MARINER SYSTEMS INDUSTRIES S.A.",
        "payer_name": "GOSSAMER HOUSE DISTRIBUTION",
        "payment_date": "2024-12-25",
        "payment_id": "P000036",
        "shipment_id": "S000036"
      },
      {
        "amount_usd": 43144.75,
        "currency": "USD",
        "insurer": "EMBER UNDERWRITERS",
        "intermediary_bank": "RIVERMARK FINANCE",
        "method": "LC",
        "payee_name": "MARINER SYSTEMS INDUSTRIES S.A.",
        "payer_name": "CANTICLE CO TRADING",
        "payment_date": "2024-02-10",
        "payment_id": "P000061",
        "shipment_id": "S000061"
      },
      {
        "amount_usd": 181197.97,
        "currency": "USD",
        "insurer": "",
        "intermediary_bank": "RIVERMARK FINANCE",
        "method": "LC",
        "payee_name": "MARINER SYSTEMS INDUSTRIES S.A.",
        "payer_name": "BASALT HOUSE IMPORTS",
        "payment_date": "2024-02-18",
        "payment_id": "P000064",
        "shipment_id": "S000064"
      }
    ],
    "procurement": [
      {
        "award_date": "2024-04-07",
        "buyer_name": "NEBULA PARTNERS PROJECTS",
        "description": "MARITIME_SHIPBUILDING_PORTS PROCUREMENT (INVENTED)",
        "domain": "maritime_shipbuilding_ports",
        "notice_date": "2024-12-16",
        "supplier_name": "MARINER SYSTEMS INDUSTRIES S.A.",
        "tender_id": "T00009",
        "value_usd": 117472.66
      },
      {
        "award_date": "2024-09-27",
        "buyer_name": "CANTICLE CO DISTRIBUTION",
        "description": "PROCUREMENT PROCUREMENT (INVENTED)",
        "domain": "procurement",
        "notice_date": "2024-09-27",
        "supplier_name": "MARINER SYSTEMS INDUSTRIES S.A.",
        "tender_id": "T00012",
        "value_usd": 98913.18
      }
    ],
    "research_links": [
      {
        "entity_name": "MARINER SYSTEMS INDUSTRIES S.A.",
        "lab_name": "AURELINE LAB",
        "link_date": "2024-08-27",
        "link_id": "R00010",
        "publication_title": "INVENTED STUDY 10: GUIDANCE",
        "similarity": 0.733
      }
    ],
    "services": [
      {
        "counterparty_name": "LANTERN HOUSE PROJECTS",
        "description": "TRAINING SERVICE (INVENTED)",
        "end_date": "2024-07-31",
        "provider_name": "MARINER SYSTEMS INDUSTRIES S.A.",
        "service_id": "SV00011",
        "service_type": "TRAINING",
        "start_date": "2024-07-01",
        "value_usd": 23889.84
      }
    ]
  },
  "claim": "Entity exhibits elevated chokepoint exposure under the reference scoring model.",
  "created_at": "2011-08-17T01:14:34Z",
  "entity": {
    "chokepoint_score": 0.0,
    "country": "BR",
    "entity_id": "E0014",
    "entity_name": "MARINER SYSTEMS INDUSTRIES S.A.",
    "shipment_count": 8,
    "total_value_usd": 837079.72
  },
  "evidence": [
    {
      "domain": "intangibles",
      "hs_code": "998120",
      "incoterm": "EXW",
      "match_score": 1.0,
      "match_status": "MATCH",
      "ship_date": "2024-07-20",
      "shipment_id": "S000011",
      "transport_mode": "AIR",
      "value_usd": 81323.72
    },
    {
      "domain": "finance_signals",
      "hs_code": "997000",
      "incoterm": "FOB",
      "match_score": 1.0,
      "match_status": "MATCH",
      "ship_date": "2024-11-07",
      "shipment_id": "S000021",
      "transport_mode": "AIR",
      "value_usd": 59952.74
    },
    {
      "domain": "medical_bio_lab",
      "hs_code": "382219",
      "incoterm": "CIF",
      "match_score": 1.0,
      "match_status": "MATCH",
      "ship_date": "2024-12-25",
      "shipment_id": "S000036",
      "transport_mode": "AIR",
      "value_usd": 106656.2
    },
    {
      "domain": "medical_bio_lab",
      "hs_code": "901890",
      "incoterm": "DAP",
      "match_score": 1.0,
      "match_status": "MATCH",
      "ship_date": "2024-02-10",
      "shipment_id": "S000061",
      "transport_mode": "AIR",
      "value_usd": 38389.51
    },
    {
      "domain": "energy_equipment",
      "hs_code": "841011",
      "incoterm": "CFR",
      "match_score": 1.0,
      "match_status": "MATCH",
      "ship_date": "2024-02-18",
      "shipment_id": "S000064",
      "transport_mode": "AIR",
      "value_usd": 193496.43
    }
  ],
  "hashes": {
    "packet": "e7590dea33df31fe0ba69e12b55b7a25548cc5fb5a821638b8630d1b63dfec31"
  },
  "lineage": [
    "RESOLVE",
    "ANALYZE",
    "EXPORT"
  ],
  "packet_id": "packet-E0014",
  "review": {
    "reason": "sufficient_confidence",
    "status": "CLEAR"
  },
  "run_id": "run-781327b7-a7a5",
  "schema_version": "1.0"
}
