{
  "annexes": {
    "intangibles": [],
    "maritime_legs": [],
    "payments": [
      {
        "amount_usd": 29302.21,
        "currency": "USD",
        "insurer": "EMBER UNDERWRITERS",
        "intermediary_bank": "HARBORLIGHT TRUST",
        "method": "WIRE",
        "payee_name": "LANTERN HOLDINGS LOGISTICS KK",
        "payer_name": "FATHOM HOUSE SUPPLY",
        "payment_date": "2024-02-02",
        "payment_id": "P000004",
        "shipment_id": "S000004"
      },
      {
        "amount_usd": 211579.16,
        "currency": "USD",
        "insurer": "CIRRUS INSURANCE",
        "intermediary_bank": "SABLE CLEARING",
        "method": "CARD",
        "payee_name": "LANTERN HOLDINGS LOGISTICS KK",
        "payer_name": "LANTERN VENTURES IMPORTS",
        "payment_date": "2024-04-08",
        "payment_id": "P000006",
        "shipment_id": "S000006"
      },
      {
        "amount_usd": 98262.64,
        "currency": "USD",
        "insurer": "",
        "intermediary_bank": "RIVERMARK FINANCE",
        "method": "NETTING",
        "payee_name": "LANTERN HOLDINGS LOGISTICS KK",
        "payer_name": "QUARRY HOUSE DISTRIBUTION",
        "payment_date": "2024-05-27",
        "payment_id": "P000044",
        "shipment_id": "S000044"
      },
      {
        "amount_usd": 232180.86,
        "currency": "USD",
        "insurer": "EMBER UNDERWRITERS",
        "intermediary_bank": "STONEBRIDGE BANK",
        "method": "NETTING",
        "payee_name": "LANTERN HOLDINGS LOGISTICS KK",
        "payer_name": "QUARRY CO TRADING",
        "payment_date": "2024-10-23",
        "payment_id": "P000051",
        "shipment_id": "S000051"
      },
      {
        "amount_usd": 35154.31,
        "currency": "USD",
        "insurer": "",
        "intermediary_bank": "HARBORLIGHT TRUST",
        "method": "NETTING",
        "payee_name": "LANTERN HOLDINGS LOGISTICS KK",
        "payer_name": "KESTREL PARTNERS PROJECTS",
        "payment_date": "2024-03-05",
        "payment_id": "P000078",
        "shipment_id": "S000078"
      }
    ],
    "procurement": [],
    "research_links": [],
    "services": []
  },
  "claim": "Entity exhibits elevated chokepoint exposure under the reference scoring model.",
  "created_at": "2004-06-19T15:08:48Z",
  "entity": {
    "chokepoint_score": 0.0,
    "country": "JP",
    "entity_id": "E0009",
    "entity_name": "LANTERN HOLDINGS LOGISTICS KK",
    "shipment_count": 6,
    "total_value_usd": 619025.66
  },
  "evidence": [
    {
      "domain": "chem_precursors",
      "hs_code": "290410",
      "incoterm": "DAP",
      "match_score": 1.0,
      "match_status": "MATCH",
      "ship_date": "2024-02-02",
      "shipment_id": "S000004",
      "transport_mode": "RAIL",
      "value_usd": 22787.89
    },
    {
      "domain": "maritime_shipbuilding_ports",
      "hs_code": "890120",
      "incoterm": "CFR",
      "match_score": 1.0,
      "match_status": "MATCH",
      "ship_date": "2024-04-08",
      "shipment_id": "S000006",
      "transport_mode": "AIR",
      "value_usd": 197586.37
    },
    {
      "domain": "machine_tools",
      "hs_code": "847989",
      "incoterm": "DAP",
      "match_score": 1.0,
      "match_status": "MATCH",
      "ship_date": "2024-05-27",
      "shipment_id": "S000044",
      "transport_mode": "RAIL",
      "value_usd": 107431.79
    },
    {
      "domain": "maritime_shipbuilding_ports",
      "hs_code": "842641",
      "incoterm": "CIF",
      "match_score": 1.0,
      "match_status": "MATCH",
      "ship_date": "2024-10-23",
      "shipment_id": "S000051",
      "transport_mode": "ROAD",
      "value_usd": 185930.65
    },
    {
      "domain": "finance_signals",
      "hs_code": "997020",
      "incoterm": "EXW",
      "match_score": 1.0,
      "match_status": "MATCH",
      "ship_date": "2024-03-05",
      "shipment_id": "S000078",
      "transport_mode": "RAIL",
      "value_usd": 37233.95
    }
  ],
  "hashes": {
    "packet": "a60a21d07d8391a9903d430e430239692ff956de6d829c43b1817e587116d385"
  },
  "lineage": [
    "RESOLVE",
    "ANALYZE",
    "EXPORT"
  ],
  "packet_id": "packet-E0009",
  "review": {
    "reason": "sufficient_confidence",
    "status": "CLEAR"
  },
  "run_id": "run-781327b7-a7a5",
  "schema_version": "1.0"
}
