{
  "annexes": {
    "intangibles": [],
    "maritime_legs": [
      {
        "arrive_date": "2024-12-06",
        "carrier": "GULLSTREAM CARRIERS",
        "depart_date": "2024-12-06",
        "from_port": "PORT JUNIPER",
        "leg_id": "L000030",
        "shipment_id": "S000030",
        "to_port": "PORT IRONLEAF",
        "transshipment": 1,
        "vessel_type": "TANKER"
      },
      {
        "arrive_date": "2024-05-17",
        "carrier": "HELIOS MARITIME",
        "depart_date": "2024-05-17",
        "from_port": "PORT NEBULA",
        "leg_id": "L000055",
        "shipment_id": "S000055",
        "to_port": "PORT CORMORANT",
        "transshipment": 0,
        "vessel_type": "TANKER"
      }
    ],
    "payments": [
      {
        "amount_usd": 92821.67,
        "currency": "USD",
        "insurer": "EMBER UNDERWRITERS",
        "intermediary_bank": "RIVERMARK FINANCE",
        "method": "CARD",
        "payee_name": "LANTERN ENGINEERING LABORATORIES LTD",
        "payer_name": "AURELINE HOUSE IMPORTS",
        "payment_date": "2024-12-06",
        "payment_id": "P000030",
        "shipment_id": "S000030"
      },
      {
        "amount_usd": 266107.14,
        "currency": "USD",
        "insurer": "",
        "intermediary_bank": "HARBORLIGHT TRUST",
        "method": "NETTING",
        "payee_name": "LANTERN ENGINEERING LABORATORIES LTD",
        "payer_name": "GOSSAMER CO DISTRIBUTION",
        "payment_date": "2024-05-17",
        "payment_id": "P000055",
        "shipment_id": "S000055"
      },
      {
        "amount_usd": 307750.2,
        "currency": "USD",
        "insurer": "",
        "intermediary_bank": "RIVERMARK FINANCE",
        "method": "NETTING",
        "payee_name": "LANTERN-ENGINEERING-LABORATORIES-LTD",
        "payer_name": "QUARRY CO SUPPLY",
        "payment_date": "2024-04-12",
        "payment_id": "P000069",
        "shipment_id": "S000069"
      },
      {
        "amount_usd": 165695.03,
        "currency": "USD",
        "insurer": "",
        "intermediary_bank": "STONEBRIDGE BANK",
        "method": "NETTING",
        "payee_name": "LANTERN ENGINEERING LABORATORIES LTD",
        "payer_name": "EQUINOX CO HOLDING",
        "payment_date": "2024-03-21",
        "payment_id": "P000075",
        "shipment_id": "S000075"
      },
      {
        "amount_usd": 148687.14,
        "currency": "USD",
        "insurer": "",
        "intermediary_bank": "SABLE CLEARING",
        "method": "WIRE",
        "payee_name": "LANTERN ENGINEERING LABORATORIES LTD",
        "payer_name": "TIDEMARK HOUSE DISTRIBUTION",
        "payment_date": "2024-10-16",
        "payment_id": "P000114",
        "shipment_id": "S000114"
      }
    ],
    "procurement": [],
    "research_links": [
      {
        "entity_name": "LANTERN ENGINEERING LABORATORIES LTD",
        "lab_name": "EQUINOX LAB",
        "link_date": "2024-10-04",
        "link_id": "R00002",
        "publication_title": "INVENTED STUDY 2: THERMALS",
        "similarity": 0.869
      },
      {
        "entity_name": "LANTERN ENGINEERING LABORATORIES LTD",
        "lab_name": "LANTERN LAB",
        "link_date": "2024-12-12",
        "link_id": "R00012",
        "publication_title": "INVENTED STUDY 12: MATERIALS",
        "similarity": 0.397
      }
    ],
    "services": []
  },
  "claim": "Entity exhibits elevated chokepoint exposure under the reference scoring model.",
  "created_at": "2011-07-08T22:32:11Z",
  "entity": {
    "chokepoint_score": 0.0,
    "country": "GB",
    "entity_id": "E0002",
    "entity_name": "LANTERN ENGINEERING LABORATORIES LTD",
    "shipment_count": 8,
    "total_value_usd": 1047774.15
  },
  "evidence": [
    {
      "domain": "maritime_shipbuilding_ports",
      "hs_code": "842620",
      "incoterm": "FCA",
      "match_score": 1.0,
      "match_status": "MATCH",
      "ship_date": "2024-12-06",
      "shipment_id": "S000030",
      "transport_mode": "SEA",
      "value_usd": 88275.11
    },
    {
      "domain": "energy_equipment",
      "hs_code": "841199",
      "incoterm": "DAP",
      "match_score": 1.0,
      "match_status": "MATCH",
      "ship_date": "2024-05-17",
      "shipment_id": "S000055",
      "transport_mode": "SEA",
      "value_usd": 238593.36
    },
    {
      "domain": "maritime_shipbuilding_ports",
      "hs_code": "842641",
      "incoterm": "EXW",
      "match_score": 1.0,
      "match_status": "MATCH",
      "ship_date": "2024-04-12",
      "shipment_id": "S000069",
      "transport_mode": "RAIL",
      "value_usd": 269811.39
    },
    {
      "domain": "aerospace_uas_avionics",
      "hs_code": "880730",
      "incoterm": "CFR",
      "match_score": 1.0,
      "match_status": "MATCH",
      "ship_date": "2024-03-21",
      "shipment_id": "S000075",
      "transport_mode": "RAIL",
      "value_usd": 146745.05
    },
    {
      "domain": "maritime_shipbuilding_ports",
      "hs_code": "731449",
      "incoterm": "EXW",
      "match_score": 1.0,
      "match_status": "MATCH",
      "ship_date": "2024-10-16",
      "shipment_id": "S000114",
      "transport_mode": "ROAD",
      "value_usd": 155759.58
    }
  ],
  "hashes": {
    "packet": "e64f29fef22a8d4506dd6f3784098d69c71b4b3ad74ea899a08e437d9e2d8389"
  },
  "lineage": [
    "RESOLVE",
    "ANALYZE",
    "EXPORT"
  ],
  "packet_id": "packet-E0002",
  "review": {
    "reason": "sufficient_confidence",
    "status": "CLEAR"
  },
  "run_id": "run-781327b7-a7a5",
  "schema_version": "1.0"
}
