{
  "annexes": {
    "intangibles": [],
    "maritime_legs": [
      {
        "arrive_date": "2024-08-31",
        "carrier": "HELIOS MARITIME",
        "depart_date": "2024-08-31",
        "from_port": "PORT CORMORANT",
        "leg_id": "L000060",
        "shipment_id": "S000060",
        "to_port": "PORT ORCHID",
        "transshipment": 0,
        "vessel_type": "TANKER"
      }
    ],
    "payments": [
      {
        "amount_usd": 28125.0,
        "currency": "USD",
        "insurer": "",
        "intermediary_bank": "STONEBRIDGE BANK",
        "method": "WIRE",
        "payee_name": "JUNIPER LABORATORIES PRECISION PTE",
        "payer_name": "BASALT CO PROJECTS",
        "payment_date": "2024-09-22",
        "payment_id": "P000028",
        "shipment_id": "S000028"
      },
      {
        "amount_usd": 29485.22,
        "currency": "USD",
        "insurer": "CIRRUS INSURANCE",
        "intermediary_bank": "SABLE CLEARING",
        "method": "NETTING",
        "payee_name": "JUNIPER-LABORATORIES-PRECISION-PTE",
        "payer_name": "AURELINE HOUSE IMPORTS",
        "payment_date": "2024-03-08",
        "payment_id": "P000045",
        "shipment_id": "S000045"
      },
      {
        "amount_usd": 145469.16,
        "currency": "USD",
        "insurer": "EMBER UNDERWRITERS",
        "intermediary_bank": "STONEBRIDGE BANK",
        "method": "LC",
        "payee_name": "JUNIPER LABORATORIES PRECISION PTE",
        "payer_name": "DORIAN PARTNERS IMPORTS",
        "payment_date": "2024-08-31",
        "payment_id": "P000060",
        "shipment_id": "S000060"
      }
    ],
    "procurement": [],
    "research_links": [],
    "services": [
      {
        "counterparty_name": "AURELINE GLOBAL IMPORTS",
        "description": "CALIBRATION SERVICE (INVENTED)",
        "end_date": "2024-02-05",
        "provider_name": "JUNIPER LABORATORIES PRECISION PTE",
        "service_id": "SV00007",
        "service_type": "CALIBRATION",
        "start_date": "2024-11-12",
        "value_usd": 36337.42
      }
    ]
  },
  "claim": "Entity exhibits elevated chokepoint exposure under the reference scoring model.",
  "created_at": "2006-11-21T21:00:25Z",
  "entity": {
    "chokepoint_score": 0.0,
    "country": "DE",
    "entity_id": "E0020",
    "entity_name": "JUNIPER LABORATORIES PRECISION PTE",
    "shipment_count": 3,
    "total_value_usd": 250787.01
  },
  "evidence": [
    {
      "domain": "research_links",
      "hs_code": "995020",
      "incoterm": "CFR",
      "match_score": 1.0,
      "match_status": "MATCH",
      "ship_date": "2024-09-22",
      "shipment_id": "S000028",
      "transport_mode": "ROAD",
      "value_usd": 32433.58
    },
    {
      "domain": "services",
      "hs_code": "999720",
      "incoterm": "EXW",
      "match_score": 1.0,
      "match_status": "MATCH",
      "ship_date": "2024-03-08",
      "shipment_id": "S000045",
      "transport_mode": "RAIL",
      "value_usd": 40266.03
    },
    {
      "domain": "aerospace_uas_avionics",
      "hs_code": "880240",
      "incoterm": "DAP",
      "match_score": 1.0,
      "match_status": "MATCH",
      "ship_date": "2024-08-31",
      "shipment_id": "S000060",
      "transport_mode": "SEA",
      "value_usd": 178087.4
    }
  ],
  "hashes": {
    "packet": "a5407790c8c1b6de84e08c1c6a1db8bd44d69bf00a5a529a42c84482cc881d17"
  },
  "lineage": [
    "RESOLVE",
    "ANALYZE",
    "EXPORT"
  ],
  "packet_id": "packet-E0020",
  "review": {
    "reason": "sufficient_confidence",
    "status": "CLEAR"
  },
  "run_id": "run-781327b7-a7a5",
  "schema_version": "1.0"
}
